{"$schema":"https://json-schema.org/draft/2020-12/schema","type":"object","additionalProperties":false,"required":["artifact_class","empirical","scientific_status","evidence_eligible","expert_validated","claim_ids","identity","protocol_sha256","implementation_sha256","freeze_status"],"properties":{"artifact_class":{"const":"a0x-leg-freeze-manifest"},"empirical":{"const":true},"scientific_status":{"const":"exploratory"},"evidence_eligible":{"const":false},"expert_validated":{"const":false},"claim_ids":{"type":"array","maxItems":0},"identity":{"$ref":"#/$defs/identity"},"protocol_sha256":{"$ref":"#/$defs/sha"},"implementation_sha256":{"$ref":"#/$defs/sha"},"freeze_status":{"const":"frozen"}},"$defs":{"sha":{"type":"string","pattern":"^[a-f0-9]{64}$"},"revision":{"type":"string","pattern":"^[a-f0-9]{40}$"},"identity":{"type":"object","additionalProperties":false,"required":["leg","protocol_id","protected_tree_sha256","selection_corpus_sha256","source_base_commit"],"properties":{"leg":{"enum":["a0","r1"]},"protocol_id":{"type":"string","minLength":1},"protected_tree_sha256":{"$ref":"#/$defs/sha"},"selection_corpus_sha256":{"$ref":"#/$defs/sha"},"source_base_commit":{"$ref":"#/$defs/revision"}}}}}
