{
  "artifact_class": "a0x-leg-freeze-manifest",
  "claim_ids": [],
  "empirical": true,
  "evidence_eligible": false,
  "expert_validated": false,
  "freeze_status": "frozen",
  "identity": {
    "leg": "r1",
    "protected_tree_sha256": "9b2a4d07c36eab3141d45258f3956c00d735e2911969447a585e227ee7bbeaa8",
    "protocol_id": "a0x-r1-six-model-v1",
    "selection_corpus_sha256": "46c5cdf796f2abad709deb3066cfadd5fc6e6a30f55a737b3408e0a15b065c06",
    "source_base_commit": "188eb65b5e249923baddadeba52659f07fcd1609"
  },
  "implementation_sha256": "b40d21ea66ed5e417c3349b91b5cef420b01c1e235b8724d08b6a6f54129ac45",
  "protocol_sha256": "fd24072406364dc57beed56854c91c43c5c4ee3ef1d59c0a70abbae663b4c6c8",
  "scientific_status": "exploratory"
}
