{"artifact_class":"a0x-leg-freeze-manifest","claim_ids":[],"empirical":true,"evidence_eligible":false,"expert_validated":false,"freeze_status":"frozen","identity":{"leg":"a0","protected_tree_sha256":"334a24453b3f7449300df25174737ac92fdfd2914f72d7c83550685c8d7524bd","protocol_id":"a0x-a0-six-model-v1","selection_corpus_sha256":"cf762fdb8e19c5d047910f1f65b353df06f31096cea27adf504ae8e0bccbf295","source_base_commit":"188eb65b5e249923baddadeba52659f07fcd1609"},"implementation_sha256":"2770e54ad7e2f8eb42be78648ba947cb552827384b2064a92956b3e36a7e8a36","protocol_sha256":"61020c660d7884be6ca1972575ad8a95ac093751d2e5d7b43095d49e12da874e","scientific_status":"exploratory"}
