{
  "artifact_class": "a0x-leg-freeze-manifest",
  "claim_ids": [],
  "empirical": true,
  "evidence_eligible": false,
  "expert_validated": false,
  "freeze_status": "frozen",
  "identity": {
    "leg": "a0",
    "protected_tree_sha256": "8257ef795760bffe37ff343db2c48ab024039dae18a02b235de909346fa096c4",
    "protocol_id": "a0x-a0-six-model-v1",
    "selection_corpus_sha256": "cf762fdb8e19c5d047910f1f65b353df06f31096cea27adf504ae8e0bccbf295",
    "source_base_commit": "188eb65b5e249923baddadeba52659f07fcd1609"
  },
  "implementation_sha256": "cb5d7ff8c028918c8459b09b77e23d1c3a4a951223793a2e15123b44462ae767",
  "protocol_sha256": "370de9fa95caa42bb7d5a1e1169d6bba100d0cde2ef220f2f8a4cebd3de90211",
  "scientific_status": "exploratory"
}
